{
  "header": {
    "schema": "observation",
    "schema_version": "0.1.0",
    "msg_id": "7f3c2a10-5b6e-4c1d-9a08-0c1d2e3f4a5b",
    "uav_id": "uav-01",
    "mission_id": "M-20261002-001",
    "stamp_utc": "2026-10-02T03:14:35.700Z",
    "producer": "cv/perception_service@0.1.0"
  },
  "view_id": 1,
  "clip_id": "M-20261002-001/v1",
  "valid": true,
  "invalid_reasons": [],
  "llr": 2.4,
  "observation_model_version": "0.1.0",
  "context": {
    "range_m": 180.3,
    "height_above_target_m": 100.0,
    "sun_rel_azimuth_deg": 166.9,
    "sun_elevation_deg": 52.7,
    "target_in_fov": true,
    "base_occlusion_ratio": null
  },
  "smoke": {
    "detected": true,
    "max_score": 0.81,
    "regions": [
      {
        "bbox_norm": [
          0.44,
          0.21,
          0.61,
          0.58
        ],
        "score": 0.81,
        "area_frac": 0.063
      }
    ]
  },
  "features": {
    "flow_vertical_mps": 1.34,
    "flow_divergence": 0.21,
    "flow_coherence": 0.77,
    "source_point_score": 0.68
  },
  "landcover_at_base": null,
  "latency_ms": {
    "total": 3380.0,
    "decode": 410.0,
    "stabilize": 520.0,
    "detect": 1150.0,
    "flow": 980.0,
    "classify": 40.0
  },
  "provenance": {
    "component": "cv/perception_service",
    "version": "0.1.0",
    "config_hash": "sha256:6d5906050e06d6c7ac0114e202a7c8a2ccbef2ee7a922ac7f0a88825b769defe",
    "git_sha": "5f726af",
    "methods": {
      "quality_gate": "heuristic_gate",
      "stabilization": "ecc_affine",
      "detector": "yolo11n",
      "plume_tracker": "iou_tracker",
      "motion_features": "dis_flow",
      "clip_classifier": "gbdt",
      "calibrator": "isotonic_binned",
      "runtime": "ncnn"
    },
    "artifacts": [
      {
        "name": "cv-bundle",
        "version": "0.1.0"
      },
      {
        "name": "observation_model",
        "version": "0.1.0"
      }
    ]
  }
}
